12/8/2017 18:04:14,CS 340 - Introduction to Databases,3,18+ hours,"Start the final project as early as possible, get a solid partner for said final project (aka don't do it alone).",FA 2017,Yes,CS 271 - Computer Architecture & Assembly Language,4,13-18 hours,"Stay in the books, do all the review questions (in the book and in the lectures). Overall well organized and put together. ",No,,,,
12/9/2017 10:55:38,CS 290 - Web Development,2,0-5 hours,"If you've never seen HTML/CSS this is perhaps an uphill battle, however I found it to be easier than 161.  The last assignment is the only thing that will have you scratching your head for a couple days as you are asked to bring everything together, but if you just look over past assignments it will make sense.  You are given 2-3 weeks to complete it.  Make sure you get 100% on all assignments as that is literally 75% of the final grade.  Final project has very low standards for getting a 100% (basic website with menu bar, pictures, etc).  No midterm, final is aight and covers a bunch of minutiae you barely ever saw in class...if you did the assignments like I advised you can get an F on the final and still get an A in the class.",FA 2017,Yes,CS 261 - Data Structures,3,13-18 hours,"I believe your group will be a big determiner in how you feel about this class. The material learned here is vital to separating you from the posers so do give it the attention it deserves.  The concepts require a good deal of abstract thinking, but if you give some effort you should be able to get an A pretty easily.  Reading chapters is not important.  I never read anything after the midterm and did great in the class.  Literally everything you need for the assignments/exams is in the videos/worksheets.",No,,,,
12/10/2017 8:14:09,CS 165 - Intro to Computer Science (Accelerated),3,18+ hours,Study c++ syntax,FA 2017,No,,,,,,,,,
12/10/2017 8:17:10,CS 165 - Intro to Computer Science (Accelerated),3,18+ hours,Study c++ syntax,FA 2017,No,,,,,,,,,
12/12/2017 15:12:55,CS 290 - Web Development,3,6-12 hours,Use outside resources. The majority of the grade is based on assignments/activities so it's easy enough to do well. The end of the course is where topics tend to get overwhelming and confusing; the material provided isn't incredibly helpful so try to find some supplemental resources in the last few weeks. The final is pretty difficult. Make sure to put plenty of information on your note sheet of things you wouldn't expect to need to know for the final.,FA 2017,Yes,CS 261 - Data Structures,4,18+ hours,"This course has a lot of busy work (worksheets) and the programs can end up taking a fair amount of time to finish. The majority of your grade in this class will come from the midterm and final, so make sure you thoroughly understand all the topics before going into each exam and take plenty of time to review the practice tests in order to do well in this course.",Yes,CS 340 - Introduction to Databases,4,6-12 hours,"The majority of this class isn't very time consuming -- however, this course is incredibly back heavy. The final project is incredibly time consuming and you will not be able to finish it if you put it off. I recommend finding a good partner to do the project with and starting early to make the work more bearable. A lot of the SQL concepts didn't fully click with me until the end when reviewing relational algebra, so don't worry if it seems overwhelming at first. This class has a good way to pad your grade a bit with the quizzes, as you can retake them until you get a perfect score. There isn't a lot of homework, but some of the assignments can be time consuming so don't put them off."
12/18/2017 14:56:17,CS 271 - Computer Architecture & Assembly Language,3,6-12 hours,Study the lectures an the text book! Assembly programming is only part of the class! I found it to be easy once you dedicate the time watch all the lectures and read the text book.,FA 2017,Yes,CS 261 - Data Structures,3,6-12 hours,"Spend time learning how each data structure works, not just the code. There will be many questions on the theory as well as Big-o. The exams are worth a large part of the grade so don't shrug off learning the theory. Still, an enjoyable a fascinating class!",No,,,,
12/19/2017 8:59:37,CS 290 - Web Development,3,6-12 hours,"Don't get complacent with the first few weeks. HTML and CSS are easy and not covered. The final isn't as bad as everyone says, get your grade up before going in and don't worry about it. Think about how to start the projects before you start the base of the server side stuff is important.",FA 2017,Yes,CS 261 - Data Structures,3,13-18 hours,Data structures are pretty boring but they are the basis of computer science. This is one of the things you will probably not learn as well if you rushed your education(bootcamp).  This is something that separates programming from computer science.,No,,,,
12/19/2017 19:10:12,CS 261 - Data Structures,3,18+ hours,"Do all the worksheets yourself, even if your group splits them up. The class has a nice slow-down around the midterm and final so you should have some time to study for these tests. Since tests are over half your grade in this class, take them seriously - the midterm is heavier on coding, the final is heavier on trivia type questions. I made a huge stack of flash cards full of tidbits, trivia, and dry facts (run time complexities, signatures, etc. of data structures) and studied them for the midterm and final. Doing this helped me earn an A in 261.",FA 2017,No,,,,,,,,,
1/2/2018 0:50:26,CS 162 - Intro to Computer Science II,3,18+ hours,"This class isn't very difficult, but it requires a LOT of work. I didn't think the material was difficult, but I still probably spent about 20 hours per week on the class. There is a lab due every week and some larger projects due throughout the quarter. Unfortunately, there is group work and that was the most annoying part of the class for me. Start the assignments early and follow the instructions. They are usually pretty straightforward and the TAs and professor make an effort to clarify requirements.",FA 2017,Yes,CS 271 - Computer Architecture & Assembly Language,4,13-18 hours,"This class was pretty tough. You are expected to know a lot of material. The first four assignments are pretty straight forward while the last two are much more time consuming. If you have a chance, do the extra credit for the programming assignments. Study the self-checks, weekly summaries, quizzes, and programming assignments (basically everything) for the midterm and final.",No,,,,
1/4/2018 16:47:53,CS 165 - Intro to Computer Science (Accelerated),2,6-12 hours,If you're familiar with OOP it is worth your time to take the accelerated class.,SP 2017,Yes,CS 225 - Discrete Structures in Computer Science,1,0-5 hours,Just do the work. The grading is lenient so don't stress too much.,No,,,,
1/4/2018 16:54:52,CS 261 - Data Structures,2,6-12 hours,Take advantage of the opportunity to work as a group.,FA 2017,Yes,CS 271 - Computer Architecture & Assembly Language,3,6-12 hours,The class gets much harder the last 2-3 weeks. Take advantage of the extra credit and easy assignments in the beginning.  Treat weekly summaries like real quizzes.,Yes,CS 290 - Web Development,1,6-12 hours,"An easy A, fairly low stress.  The material got much harder the last few weeks but the grading was very lenient. I didn't come out of the class knowing much more than I did going in.  If you're looking for a GPA booster, this is a good course.  If you're looking to actually learn web development, this is a terrible course."
1/7/2018 12:32:36,CS 161 - Intro to Computer Science I,3,6-12 hours,,FA 2016,No,,,,,,,,,
1/11/2018 5:08:19,CS 161 - Intro to Computer Science I,2,6-12 hours,Read the book and work through the end of chapter questions - ideally with a study group. ,FA 2017,Yes,CS 225 - Discrete Structures in Computer Science,3,6-12 hours,"The homework, demo quizzes, real quizzes, and exams all build on each other. Use these examples.
Don't expect support from TAs or the instructor. You're on your own here.",No,,,,
2/14/2018 7:59:40,CS 325 - Analysis of Algorithms,4,6-12 hours,"Don't freak out; stay calm.  If you've never studied algorithms before (like me), then there will be weeks where you are lost. When no YouTube or reading will help, go to office hours ( I did 2 or 3 times and it helped tremendously).  At the least, office hours will get you through the HW. But for me, it helped me straighten out my thought process.  For tests, you get a whole week to study. I used each day (1-3 hours) to study 1 week of material, then used the last day to write my cheat sheet from my study notes and re-practice problems.  Remember, the problems on the midterm and final are the same structure as problems you've seen in the class and in lecture. Practice identifying the problem structures as you go and it makes getting the nitty gritty details down easier.",FA17,No,,,,,,,,,
2/20/2018 16:16:38,CS 161 - Intro to Computer Science I,3,6-12 hours,,SP 2017,Yes,CS 225 - Discrete Structures in Computer Science,4,13-18 hours,Utilize outside lectures/videos a lot in addition to course materials.,No,,,,
2/20/2018 16:18:25,CS 162 - Intro to Computer Science II,3,6-12 hours,Assignments were a bit unstructured and course materials a bit sloppy. Pay extra attention to detail in assignment requirements and provided skeleton code.,SU 2017,Yes,CS 271 - Computer Architecture & Assembly Language,4,13-18 hours,Pay extra attention to the practice questions after each lecture.,No,,,,
2/20/2018 16:20:11,CS 261 - Data Structures,3,6-12 hours,,FA 2017,Yes,CS 290 - Web Development,2,0-5 hours,Final project took much more time than the assignments. Don't delay.,Yes,CS 340 - Introduction to Databases,2,0-5 hours,"The final project took way more time than anything else in the program, so don't delay on that."
2/22/2018 7:53:27,CS 475 - Intro to Parallel Programming,2,6-12 hours,Challenging material but he made it really accessible. Great instructor and great course. Definitely watch the lectures.,SP 2017,Yes,CS 361 - Software Engineering I,2,6-12 hours,Graded discussions were total BS. I was fortunate to be placed in decent groups so it wasn't too bad overall. The final is very poorly written and tests over opinions that aren't even discussed in the lecture materials. You're given topics and told to go find information on them yourself. ,No,,,,
2/27/2018 13:24:04,CS 325 - Analysis of Algorithms,5,18+ hours,"Prepare to spend a lot of time on the class.  Start work on the midterm cheatsheet as soon as the class starts.  Consider reading Grokking Algorithms before you start the class ... it's an easy read that will help you get your bearings a bit, but the class itself is much more difficult.  If you're looking to do more to prepare, consider teaching yourself Python.  Take as a goal translating some of the more interesting data structures from the c/c++ implementation into Python.  Having working classes for graphs, vertices, etc., and a functional BFS would be great preparation.  ",WI 2018,No,,,,,,,,,
3/8/2018 8:14:40,CS 161 - Intro to Computer Science I,2,0-5 hours,"Read the book, look up how to implement unfamiliary library functions, familiarize yourself with finding answers on Stack Overflow, and always attempt to fix the first error when your program fails to compile.",WI 2018,Yes,CS 225 - Discrete Structures in Computer Science,3,6-12 hours,"The book is terrible at explaining concepts for the first half of the class (weeks 1-5), so look up videos on YouTube to make up for that. The assignments, quizzes, and tests are graded generously, so always attempt to answer a question, even if it's just a general explanation of HOW you would solve the problem.",No,,,,
3/19/2018 7:16:00,CS 325 - Analysis of Algorithms,4,18+ hours,"There is a ton of info to absorb in this class. Find the mix of lectures/reading/supplemental/code review that works best for you and don't worry about trying to get through all possible sources. The coding implementation parts of the homework can be time consuming, so it helps to take a look at those early in the week and see what's going to be involved. The exams are tough; investing time into building a good cheat sheet is very helpful.",WI 2018,Yes,CS 361 - Software Engineering I,2,6-12 hours,There isn't really a particular strategy for this course since the majority of it is random assignment (group and project topic). The individual assignments are heavily subject to instructor interpretation. There is a fair amount of writing. There isn't much in-depth instruction around the course content. It's just one of those courses you have to get through.,No,,,,
3/20/2018 22:23:36,CS 340 - Introduction to Databases,3,6-12 hours,"The final was challenging. I learned a lot through self-teaching and troubleshooting my webapp. Readings were nothing more than links to documentation and a strange page in Swedish... Similar to CS 290 (web programming) the course starts out very simple and easy and then ramps in complexity fairly quickly.

It seems like such a simple idea, select what you want from a database through joining tables but it is needlessly complicated...",WI 18,No,,,,,,,,,
3/20/2018 22:30:36,CS 340 - Introduction to Databases,1,0-5 hours,"Easy concepts and very light work throughout. I just watched lectures and probably spend <2 hours/wk during Week 1-7. Instruction more or less ends at Week 7, but don't procrastinate on the project - it can take a deceivingly long time, because not only are you doing DB stuff, you're building an interactive website, which can take some time to learn/build especially if you're not taking CS290 or have no web development experience, or trying to learn something new (React, etc.). I probably spend ~30-40 hours working on it Weeks 7-10. Final is fair.",WI 2018,Yes,CS 325 - Analysis of Algorithms,4,13-18 hours,"Concepts can be confusing, so take extra time to understand and practice. Midterm and finals are fair, but make sure you write some actual examples (especially to hard problems you can solve so you can use the solution pattern to guide you) on your cheat sheet. I recommend doing assignments in Python, great way to pick up a new language, and makes some of the assignments easier to implement. Project is not bad, and we're given more than enough time (2 weeks) to finish it - just don't research something crazy hard to implement. Overall a tougher class relatively, but fair and not bad if you aren't overly confused by concepts.",No,,,,
3/20/2018 22:40:26,CS 290 - Web Development,3,6-12 hours,"Decent class. It teaches you HTML/CSS/JavaScript, along with NodeJS - Express, Handlebars and a few other modules. The class is pretty light overall, but the assignments could take longer than you expect. Watch out for the last assignment! The difficulty of it compared to the others is way higher and can catch you off guard, especially if you're procrastinating and think you can do it in one day like your other assignments! I encourage taking time to build a decent website - you can do the bare requirements and get full points, but you walk away not really learning much, because so many things can be built copy+paste from the lecture notes. I recommend taking this class with CS340, because you can use the same project for both classes, and what you learn here will help you with the CS340 immensely (requires you to build a website with databases).",FA 2017,Yes,CS 261 - Data Structures,3,6-12 hours,"It starts off light but the concepts grow in complexity as the course progresses (linked lists, arrays, etc. --> hashtables, dictionaries, etc. --> trees --> trees/graphs traversal). Overall not a bad class, and as long as you take the time to read and watch the lectures, you should be fine. Make sure you understand the concepts each week, since they build on each other. This class should allow you to start Leetcoding with a software engineering mind :)",No,,,,
3/20/2018 22:44:54,CS 271 - Computer Architecture & Assembly Language,3,6-12 hours,"A lot of reading. Lots of reading.. but ultimately really helpful. This class can get a bit confusing, and there's a lot of frontloading the first 2-3 weeks, because there are so many new concepts, but after you get the hang of writing assembly code and registry concepts, it's not at all bad.",SP 2017,Yes,CS 225 - Discrete Structures in Computer Science,2,0-5 hours,"Can be challenging if you aren't proof/math inclined, but otherwise very easy and light. Study and make sure you understand the proofs and why, don't just memorize patterns. It's helpful for later courses.",No,,,,
3/20/2018 23:52:35,CS 271 - Computer Architecture & Assembly Language,4,13-18 hours,Take the summaries twice to get access to the questions. Do the early EC! Start the final project way in advance. It is so much harder than any of the other programs.,WI 2018,Yes,CS 261 - Data Structures,3,6-12 hours,Check piazza regularly. Sometimes the requirements would change there.,No,,,,
3/21/2018 0:04:09,CS 362 - Software Engineering II,2,6-12 hours,"Be thorough in your thinking.  The midterm and final, you don't really need to study for them--you just have to think things through and write out your thinking.",WI 2018,Yes,CS 373 - Defense Against the Dark Arts,3,13-18 hours,"If your quarter is like ours, you will begin to doubt if your homework is even looked at.  Don't even bother doing the labs unless you have to hand something in for them, because you will get very frustrated with missing instructions and confusing set-ups.  Just write in general about the week's topic, at some length, and you will not get any points docked at all.  It was fun to do a final presentation instead of a final exam.  Interesting course--enjoy!",No,,,,
3/21/2018 6:57:25,CS 261 - Data Structures,2,6-12 hours,Don't memorize data structure and ADT implementation really try to understand how it works.  The Midterm and Final won't be nearly as bad that way.,WI 2018,Yes,CS 290 - Web Development,2,6-12 hours,I found the 2nd half of the course to be incredibly difficult.  Don't be lulled into a sense of complacency after the first 6 weeks.  The final is also insane so try hard to go into it with 100s on all hw,No,,,,
3/21/2018 11:05:24,CS 372 - Intro to Computer Networks,4,6-12 hours,Read the textbook.  Do the no-credit weekly summary exercises to review for the tests.,WI 2018,No,,,,,,,,,
3/21/2018 15:05:38,CS 162 - Intro to Computer Science II,4,18+ hours,"Don't procrastinate. It feels overwhelming at first if your only programming experience is coming from 161. It gets a little more comfortable after about the midway mark, but it's still a ton of work most every week. Use your resources. Ask questions on Piazza. Ask questions on Slack. ",WI 2018,Yes,CS 352 - Introduction to Usability Engineering,3,0-5 hours,"Communicate well with your group and be a nice person. A lot of the material is pretty intuitive, but if you wait until the last minute, you may find yourself in a bind. The quizzes aren't that difficult, but the final expects that you've read and paid attention to the video lectures.",No,,,,
3/21/2018 16:39:15,CS 325 - Analysis of Algorithms,5,18+ hours,Study with others. Use other materials such as online articles or YouTube videos.,WI 2018,Yes,CS 290 - Web Development,3,0-5 hours,Learn some bootstrap to make things look nice. Start early for the last homework assignment.,No,,,,
3/22/2018 5:55:08,CS 372 - Intro to Computer Networks,2,6-12 hours,"Get started on the assignments early, but if you have taken CS344 already than half of the coding will carry over to CS372.  You probably don't need the book, but some questions may require outside material to answer.  Also, there are practice summary exercises in the ""Quiz"" section of Canvas - they are ungraded and can be used for additional practice.",WI 2018,No,,,,,,,,,
3/22/2018 8:18:10,CS 340 - Introduction to Databases,1,6-12 hours,Get started on the final project early. It is the only difficult assignment in the class.,WI 2018,Yes,CS 325 - Analysis of Algorithms,5,18+ hours,Get started on each weeks material early. It can take some time for the concepts on the homework to sink in.,No,,,,
3/22/2018 8:49:32,CS 271 - Computer Architecture & Assembly Language,4,6-12 hours,"This course is very fair but it is a lot of consistent work. When I say fair I do not mean is it easy. Most people have not programmed in MASM before so it can be time-consuming to wrap your head around the concepts. The lectures are very good, I stopped reading the book after about week 4 and only referenced it when needed. The homeworks are quite involved so get started ASAP. The grading is done on a TA rotation and some are much more lenient than others: keep that in mind. Midterm: study all quizzes, summaries and lecture exercise solutions. If you can do all summary and quiz problems you will do pretty well on the midterm. Final: make the practice final exam bae. Very very similar in structure. Recursion, albeit not a horribly difficult concept in high-level languages, is a bit wonky in MASM. Do the exercise solutions after all lectures, will help a ton. Piazza was pretty helpful. Slack, unfortunately, was nothing short of a toxic environment controlled by a few individuals. The circle jerk was real and it was really a shame. I think Slack on the overall is great but it became disgusting for the 271 channel. Since it was controlled by a few egomaniacs, I never really felt comfortable asking a question there. ",W 2018,Yes,CS 361 - Software Engineering I,1,0-5 hours,"If you're looking for a good way to light $1900 on fire, you've come to the right place. Almost exclusively group work and thankfully I had a pretty solid group. Use Slack to communicate with your group members, much better than Google Hangouts (esp when multiple people are involved). Rooker is a good guy but a bit of a bumbling idiot. People were overly dramatic about the final exam: it's 70 multiple choice questions and if you thoroughly review all lecture slides you will do well. No point in watching the lecture videos, just read the slides. This class is easy but the group work every week is fairly time-consuming, make sure to start it ASAP. ",No,,,,
3/22/2018 8:51:53,CS 162 - Intro to Computer Science II,1,13-18 hours,"The class isn't that bad it just requires being resourceful. Some weeks (like week 2) you get assigned 2 chapters for 200 pages of reading. Most of the material is interesting but not all of it is useful.

The lectures are useful because they demonstrate the most useful skills that are needed for the work due that week. learncpp.com is extremely helpful for getting a different perspective on certain things (inheritance and polymorphism I'm looking at you).

It doesn't hurt to read the project/lab specs for the week before doing any reading to understand what you'll need to learn. That's half the battle really. We didn't use copy constructors or operator overloading yet it takes up like 50 pages of chapter 11 which is the roughest chapter. 

Do the extra credit -- it's usually pretty trivial. The coursework is graded very fairly and may I even say a bit lenient. At the end of the semester I'm at over a 100%. ",WI 2018,Yes,CS 271 - Computer Architecture & Assembly Language,4,13-18 hours,"The course is... interesting. I liked the course overall but the material was very dry. It was like reading a verbose instruction material. It made it hard to stay focused sometimes.

I found doing the project then the quizzes the easiest. I get to play around with new techniques/concepts before being tested on them.

I studied for the midterm and final using anki flashcards. I'd pull all of the questions from the summaries/quizzes/end of section textbook review questions and put them in to a flashcard app. This helped me get an A on both major tests.

The extra credit options for the projects are worth taking. They get harder as the semester moves forward so try to do as much as possible in the beginning of the semesters in order to give yourself a buffer for the midterm and final (worth a combined 40% of your grade).

Overall I learned a lot from the class and it was well put together. The textbook was the worst part of the course so don't get discouraged with the readings. The programming assignments and extra credit will teach you the most!",No,,,,
3/22/2018 9:38:15,CS 344 - Operating Systems,2,6-12 hours,,WI 2018,Yes,CS 372 - Intro to Computer Networks,2,6-12 hours,"Would have been easier if I had taken 344 first. 70% of the grade is tests (weekly reviews, quizes, midterm, final) on canvas so take them seriously. ",No,,,,
3/22/2018 10:42:13,CS 290 - Web Development,3,0-5 hours,"Instructor simply recycles material left by the previous instructor and barely ever answers any questions on Piazza. Answers given by the instructor even when she does respond are superficial and of little help. That said, the HW assignments are easy enough, and grading is fairly lenient. Start the last two assignments early though (final project and database HW). These will take up more time than all the other assignments combined.",2018 Winter,No,,,,,,,,,
3/22/2018 10:43:46,CS 340 - Introduction to Databases,1,0-5 hours,Seek outside resources on order to learn the material and check Piazza often as the assignment requirements can change on a whim.  ,WI 2018,Yes,CS 325 - Analysis of Algorithms,3,13-18 hours,,Yes,CS 361 - Software Engineering I,1,6-12 hours,
