Timestamp,What Course Did You Take?,How hard was this class?,How much time did you spend on average (per week) for this class?,What tips would you give students taking this course?,When did you take this course?,Did You Take a Second Course This Quarter?,What Course Did You Take?,How hard was this class?,How much time did you spend on average (per week) for this class?,What tips would you give students taking this course?,Did You Take a Third Course This Quarter?,What Course Did You Take?,How hard was this class?,How much time did you spend on average (per week) for this class?,What tips would you give students taking this course?
8/18/2015 12:10:52,CS 271 - Computer Architecture & Assembly Language,4,6-12 hours,"Make sure you do and understand the self-check exercises after the lectures. The solutions are very helpful.

Study the self-check exercises and weekly summary exercises thoroughly and make sure you can do every problem - all quiz and test problems will be variations of these.

Start assignments early and always try to do the extra credit if you have time. The extra credit is usually either something you'll need for the next assignment or something that will make the extra credit for the next assignment easier and you'll want all the points you can get in this  class.",SU 2015,Yes,CS 340 - Introduction to Databases,2,0-5 hours,"Easy class, especially if you've had exposure to SQL before. Project can be time-consuming but isn't overly difficult. It helps to have some experience with HTML and PHP before taking this class.",No,,,,
8/18/2015 13:02:30,CS 271 - Computer Architecture & Assembly Language,4,13-18 hours,,SU 2015,Yes,CS 261 - Data Structures,3,6-12 hours,,No,,,,
8/18/2015 13:18:06,CS 271 - Computer Architecture & Assembly Language,4,6-12 hours,"Do NOT overlook the practice exercises provided with each lecture. If you can understand these without any help, you will be golden. ",SU 2015,No,,,,,,,,,
8/18/2015 14:23:38,CS 225 - Discrete Structures in Computer Science,3,6-12 hours,Brush up on your algebra if you haven't taken a math class in a while.,SU 2015,No,,,,,,,,,
8/18/2015 17:04:36,CS 340 - Introduction to Databases,1,0-5 hours,Good choive for short summer session. Very light workload. Get started on final project early. Prepare to supplement course lectures with material from the web.,SU 2015,Yes,CS 271 - Computer Architecture & Assembly Language,4,6-12 hours,"Proctored tests are very difficult. Assignments start off easy, but the last few can be very time consuming. Study the weekly self-checks and the summary exercises to do well on the proctored exams.",No,,,,
8/19/2015 13:15:30,CS 161 - Intro to Computer Science I,4,18+ hours,"Ideally come into 161 with prior programming experience.  If not, be sure to do the readings and watch the lectures.  Doing the programming challenges at the end of each chapter in addition to the homework really helps with solidifying the material as well.",SU 2015,No,,,,,,,,,
8/19/2015 21:42:38,CS 261 - Data Structures,3,6-12 hours,"Watch the lectures before doing the worksheets and assignments, often part of the answers will be presented.",SU 2015,No,,,,,,,,,
8/20/2015 7:01:21,CS 161 - Intro to Computer Science I,3,6-12 hours,Don't procrastinate!,FA 2014,Yes,CS 225 - Discrete Structures in Computer Science,3,0-5 hours,Get ready for induction it's probably the most difficult topic in this class. And brush up on algebra it should be second nature.,No,,,,
8/23/2015 17:44:19,CS 161 - Intro to Computer Science I,3,6-12 hours,"My advice would be more relevant for students coming in with programming experience -- don't underestimate the first exam! It sounds silly, but without intending it, I had become really used to letting the compiler fix my errors for me. When it came time to do the test, where no compiler was there to catch my stupid errors for me, I was ill prepared and did much worse than expected.",SU 2015,No,,,,,,,,,
8/23/2015 22:46:17,CS 225 - Discrete Structures in Computer Science,2,0-5 hours,Just do all the work.,SP,No,,,,,,,,,
8/25/2015 18:55:42,CS 161 - Intro to Computer Science I,3,13-18 hours,Get ahead on the readings. Put the time in to understand the basics,SU 2015,No,,,,,,,,,
9/10/2015 13:20:58,CS 352 - Introduction to Usability Engineering,1,13-18 hours,"Keep communication with your group members, even if there are no assignments due in given week. Also, the final (during the summer session) was comprehensive and is mostly written. I would get fluent enough in the material to answers 25+ short-long answers in 110 minutes. It did not feel like enough time! ",SU 2015,Yes,CS 261 - Data Structures,2,13-18 hours,"I would listen to the lectures to understand the content, skim the provided readings (don't waste your time like me) and get another Algorithms/Data Structure book to supplement. Also check out this site... http://visualgo.net/ . The worksheets were 85% helpful for me, a lot of times our group would actually meet in real time through Gchat to do them, it was pretty fun. ",Yes,CS 271 - Computer Architecture & Assembly Language,4,18+ hours,"In the summer session the final was a bit tricky. I went into the final with an 88.5 (I was so proud of my grade). I studied really hard, made a superb cheatsheet and felt pretty confident / ready (just wanted to get it over with) going into the final. The final is rigorous in the sense that there were way too many questions for the time allotted. And, (perhaps I was burned out) the wording of the questions were like riddles(literally contrapostives and vague wording left and right! ). I ended up getting a B- in the class, I am still really proud of my grade! "
9/11/2015 14:48:03,CS 261 - Data Structures,2,6-12 hours,"Have the worksheets out while you watch the lectures and fill them in as you go. Use the group worksheet time to solidify your understanding.

  ",SU 2015,No,,,,,,,,,
10/7/2015 2:47:30,CS 271 - Computer Architecture & Assembly Language,4,18+ hours,Exams are tough - don't underestimate them. Get a calculator that does the conversions for you. ,SU,No,,,,,,,,,
10/10/2015 22:43:33,CS 161 - Intro to Computer Science I,1,6-12 hours,,WI 2015,Yes,CS 225 - Discrete Structures in Computer Science,1,6-12 hours,Practice makes perfect,No,,,,
10/10/2015 22:45:27,CS 162 - Intro to Computer Science II,1,6-12 hours,"Very easy, somewhat similar to CS161",SP 2015,Yes,CS 261 - Data Structures,2,13-18 hours,"Tests are pretty hard, and what ultimately ruined my A.",No,,,,
10/10/2015 22:46:33,CS 271 - Computer Architecture & Assembly Language,2,13-18 hours,,SU 2015 ,Yes,CS 352 - Introduction to Usability Engineering,1,6-12 hours,A good group/group leader makes this class much easier.,No,,,,
11/13/2015 11:57:59,CS 261 - Data Structures,4,13-18 hours,Make sure your algebra is down well. Go through the practice quizzes and study previous semester's homework solutions. Use alternate resources beyond the required reading. ,FA 2015,Yes,CS 161 - Intro to Computer Science I,4,13-18 hours,"The first few weeks start off really easy and then it starts escalating with classes, arrays and pointers. Make sure you get the fundamentals down really well as everything builds upon the previous unit. Take time designing what your code will look like before jumping into the actual coding! ",No,,,,
11/13/2015 19:44:00,CS 225 - Discrete Structures in Computer Science,4,13-18 hours,Study your algebra and get a head start on proofs!,FA 2015,Yes,CS 161 - Intro to Computer Science I,1,6-12 hours,Take an intro to programming class on EdX or Coursera in any language and you'll be set.,No,,,,
11/13/2015 23:42:19,CS 161 - Intro to Computer Science I,3,13-18 hours,,SU 2014,Yes,CS 225 - Discrete Structures in Computer Science,4,6-12 hours,,No,,,,
11/14/2015 4:25:54,CS 340 - Introduction to Databases,2,0-5 hours,The final project is the only real assignment in the course. Everything else is fairly simple. Don't get lulled into a false sense of laziness. ,SU 2015,No,,,,,,,,,
11/14/2015 10:48:39,CS 161 - Intro to Computer Science I,4,6-12 hours,,SP 2014,No,,,,,,,,,
11/14/2015 14:25:27,CS 261 - Data Structures,3,6-12 hours,,SU 2015,Yes,CS 271 - Computer Architecture & Assembly Language,5,13-18 hours,,Yes,CS 352 - Introduction to Usability Engineering,2,6-12 hours,
11/16/2015 12:41:57,CS 325 - Analysis of Algorithms,5,13-18 hours,,FA 2015,Yes,CS 340 - Introduction to Databases,2,0-5 hours,,No,,,,
11/26/2015 18:00:01,CS 161 - Intro to Computer Science I,2,0-5 hours,Pay attention to details.  Grading is done by running scripts.  Points will be lost for simple mistakes like extra spaces etc.,Su,No,,,,,,,,,
11/26/2015 18:02:34,CS 162 - Intro to Computer Science II,2,0-5 hours,"Don't spend too much time trying to figure out what the instructor wants, just do what makes sense and explain it in the reflections document.",FA 2015,Yes,CS 225 - Discrete Structures in Computer Science,3,0-5 hours,"She gives guides, use them.  Many of these questions will be on the tests.",No,,,,
11/26/2015 20:28:43,CS 162 - Intro to Computer Science II,3,0-5 hours,Do NOT wait until the last day to do the labs. Don't get hung up on details just make sure to satisfy the requirements for the assignments. The tests are unproctored but only 15 mins for 20 questions. ,FA 2015,Yes,CS 352 - Introduction to Usability Engineering,2,0-5 hours,This class is super boring and a chore to do the projects/assignments. Just pray you end up with a good leader and group.,No,,,,
11/27/2015 5:48:44,CS 161 - Intro to Computer Science I,3,6-12 hours,"I would say this class is medium difficulty (fairly easy if you have previous programming experience, possibly difficult if you don't).  I don't feel the class is too bad, but there is a lot of info thrown at you, and you need to know a lot.  The projects ramp up in difficulty, with a few easier ones here and there.  If you are having trouble, you really need to start them early as lots of people struggle right up to the end - but you never see many people asking questions earlier in the week.

The first exam probably differs a lot from what people expect from a computer science exam, and a lot of people did poorly (learn how to trace code, learn the unusual cases and what type of errors there are).  Actually messing with the errors the and warnings the book gives might be good practice. The second exam is a bit more conventional.

The professor's communication is decent, but he neglects to fully answer questions sometimes, and frequently revises assignment requirements halfway through (again, get started early).  He is also very inflexible considering this is a course partly aimed at people pursuing a second career.

The book is decent, but has lots of errors.  The course notes are helpful, but also have errors.  The video lectures were practically unwatchable to me (accent, voice, pacing).


",FA 2015,No,,,,,,,,,
11/27/2015 15:16:41,CS 261 - Data Structures,3,6-12 hours,"Do not underestimate the difficulty of the tests. Be prepared to write code, answer multiple choice questions, and take the full amount of time allotted to complete the test. The group work can make or break your understanding of the material, so fingers crossed that your group works well together. ",SP 2015,Yes,CS 290 - Web Development,5,18+ hours,The old version was brutal. Be glad it's been changed. ,No,,,,
11/28/2015 2:46:23,CS 161 - Intro to Computer Science I,3,13-18 hours,"The reading was very helpful and doing all of the exercises in the book can help ensure you're grasping the concepts. Figure out a way to learn pointers and referencing. It can be really tricky for many people. Start working on your programs as early as you can. 

For the exams, don't be fooled by how easy they seem. For the midterm especially people were really in for a shock. Go back over everything and look at it all again, Practice hand tracing! ",FA 2015,Yes,CS 225 - Discrete Structures in Computer Science,4,13-18 hours,"Make sure you're up on your algebra. Find a good youtube channel to help you through it. The reading and the videos could be confusing or not great for providing an easier way to understand what you're actually meant to be doing. 

Grading on homework seemed haphazard at best. Try to do the example problems in the book while you're reading and as many in the exercise sets as you can. ",No,,,,
12/2/2015 9:56:43,CS 161 - Intro to Computer Science I,4,13-18 hours,Plan to have to practice the material on your own. Each new concept should be practiced thoroughly until you have mastery of it BEFORE attempting the assignments. This will allow you to attack the problem with tools you understand instead of learning as you go. Don't be afraid to break things and then go back a fix it. I restructured my bigger programs a couple times each because they sucked my first go through.,FA 2014,No,,,,,,,,,
12/2/2015 21:04:37,CS 225 - Discrete Structures in Computer Science,3,6-12 hours,"Practice practice practice! If you aren't good at mathematics, there is no shortcut to get around doing practice problems. The lecture videos are very well done in my opinion, and going back to those notes always helped me. There were always plenty of examples in the book as well.",FA 2015,Yes,CS 162 - Intro to Computer Science II,4,18+ hours,"Work hard, work early! Rooker is a weird guy, things are always vague and confusing. If you're confident in your abilities, starting late can be an advantage because you have the benefit of everyone else clearing up the confusion. But, you need to be confident that you'll finish on time. The group work sucks, and the groups are too large for the amount of work that is given.",No,,,,
12/3/2015 16:06:44,CS 340 - Introduction to Databases,1,0-5 hours,"The project is the biggest part of this class. Start working on it early and submit the sections for feedback from the instructor/TA. There's a bit of connecting the dots from the lectures to assignments and quizzes, so I referenced the book a little and did used Google searches. I had no prior experience with SQL or PHP before the class. The recommended book also provided a good overview of PHP. I mostly used code from the provided example but the book helped me fill in a few gaps to do some extra things.",FA 2015,Yes,CS 290 - Web Development,3,6-12 hours,"If you can find time, create little projects on the side to help reinforce the concepts. From what I hear, it's a lot better than past quarters but there is still a lot of material to cover. Didn't use the book a lot, mostly did searches for online documentation and questions. ",No,,,,
12/8/2015 18:40:58,CS 161 - Intro to Computer Science I,4,18+ hours,"Class was a bit unorganized - lectures didn't align to the reading very well.  If you're new to programming,  don't want until due dates to compile your assignments on the school server.  Your local environment may work fine despite underlying issues.  ",WINTER 2014,No,,,,,,,,,
12/10/2015 8:57:04,CS 361 - Software Engineering I,2,6-12 hours,Take control of your group.  The second project took way more time than it should of because a couple of people became foremen rather than teammates. ,FA 2015,No,,,,,,,,,
12/10/2015 16:43:15,CS 325 - Analysis of Algorithms,5,13-18 hours,"This is a very hard class. The lectures and office hours are bad but worth watching. Read the material. Do the homework. The mid term and final are both hard. Most projects are hard. 

You will learn a lot but it will be one hell of a ride.
",FA 2015,Yes,CS 361 - Software Engineering I,1,0-5 hours,Pair with a hard class.,No,,,,
12/10/2015 18:32:55,CS 290 - Web Development,2,18+ hours,Find other resources outside of the class to learn javascript and node.js. I signed up for a udemy course (Rob Percival Build 15 Websites) since it was only $10 when I purchased. The assignments aren't too difficult but definitely get started on them early. ,FA 2015,No,,,,,,,,,
12/11/2015 4:41:21,CS 225 - Discrete Structures in Computer Science,4,18+ hours,,fa2015,No,,,,,,,,,
12/11/2015 17:25:02,CS 344 - Operating Systems,5,13-18 hours,"Start the projects early. The later you do, the more stressful it will be. Every assignment is a long and challenging slog.",FA 2015,Yes,CS 352 - Introduction to Usability Engineering,4,13-18 hours,Be active in your group. Use slack to communicate.,No,,,,
12/12/2015 10:42:00,CS 271 - Computer Architecture & Assembly Language,4,13-18 hours,"Complete as much extra credit as you can. Start writing ""cheat sheets"" for each week and you'll have an easier time writing them for the midterm/final. I rushed through the weekly summaries and could have scored better. The lectures are sort of off with the assignments but things started to make a lot more sense to me after the 3rd week. Each point will count towards reducing your stress for the final week where there will be a programming assignment, weekly summary, quiz,  and final due so get the easy ones while you can :)",FA 2015,No,,,,,,,,,
12/15/2015 8:28:57,CS 161 - Intro to Computer Science I,3,18+ hours,"Start projects early, use the tutoring services often and early if you do not get something. Do all review problems in the textbook to study for exams.",FA 2015,Yes,CS 225 - Discrete Structures in Computer Science,1,18+ hours,"The study guides for exams are spot on, make sure to know everything on the study guide. Homework is the hardest difficulty. Quizzes are easier than homework. Exams are easier than quizzes. If you know homework and quiz questions really well you will breeze through the exams no sweat.",No,,,,
12/15/2015 12:59:26,CS 225 - Discrete Structures in Computer Science,2,6-12 hours,Be prepared to use outside resources for better explanations.  The lectures are tied to the old book (Rosen) instead of the required book (Epp).,FA 2015,No,,,,,,,,,
12/15/2015 16:10:52,CS 161 - Intro to Computer Science I,1,18+ hours,,FA 2015,Yes,CS 225 - Discrete Structures in Computer Science,2,13-18 hours,,No,,,,
12/15/2015 16:49:45,CS 165 - Intro to Computer Science (Accelerated),4,18+ hours,"Understand that this is (most likely) your first taste of CS; chances of that occurring without headaches/stress/worry/doubts are slim to none.  You should know the C++ language well enough to get into trouble after this class, various condition statements such as do while loops/for loops/if-else statements/switches/etc, object oriented programming, recursion, pointers and de-referencing pointers, and you MIGHT touch a little on memory management.  You should also learn how to debug and how to do it well.  Learn how to test as you go.

The key objective in this class is not to become a know it all and perfect at the language.  The key is to understand these different concepts.  A for loop/while loop/switches/condition statements etc will generally be the same in all languages.  They use the same pseudo code and thus are written very similarly.  Once you know these concepts, picking up other languages is extremely easy.",SP 2015,Yes,CS 225 - Discrete Structures in Computer Science,3,13-18 hours,"This class really isn't that bad.  For a person coming in with a non stem background it could be a challenge because a lot of the concepts are...weird.  Especially when you get into recursion and Iterations.  Make use of the tutors, don't underestimate their ability and worth.",No,,,,
12/15/2015 16:56:41,CS 261 - Data Structures,3,6-12 hours,Just get it over with....I am not impressed with the structure of this class but she is overly fair and wants you to succeed.,SU 2015,Yes,CS 271 - Computer Architecture & Assembly Language,4,18+ hours,"This class is one of my favorites in the program thus far (and I am almost done), a lot of people don't like it though mostly because of the assembly language.  Embrace it; whether you know it or not, these are your roots as a CS professional.  If you played old video games ever, if you have ever installed drivers, if you have ever wondered how the PC and software talk...then those are all answered through low level languages like C and Assembly.  

That is also important to note; C will be used heavily from this point on and to debug certain problems in C you will need to know how assembly interacts with the computer.  ",Yes,CS 352 - Introduction to Usability Engineering,1,0-5 hours,"save this class for a known hard class.  Known hard classes are 290/325/372/and potentially 496.
"
12/15/2015 16:56:53,CS 261 - Data Structures,3,6-12 hours,Just get it over with....I am not impressed with the structure of this class but she is overly fair and wants you to succeed.,SU 2015,Yes,CS 271 - Computer Architecture & Assembly Language,4,18+ hours,"This class is one of my favorites in the program thus far (and I am almost done), a lot of people don't like it though mostly because of the assembly language.  Embrace it; whether you know it or not, these are your roots as a CS professional.  If you played old video games ever, if you have ever installed drivers, if you have ever wondered how the PC and software talk...then those are all answered through low level languages like C and Assembly.  

That is also important to note; C will be used heavily from this point on and to debug certain problems in C you will need to know how assembly interacts with the computer.  ",Yes,CS 352 - Introduction to Usability Engineering,1,0-5 hours,"save this class for a known hard class.  Known hard classes are 290/325/372/and potentially 496.
"
12/18/2015 12:16:15,CS 271 - Computer Architecture & Assembly Language,3,6-12 hours,"DO as much of the extra credit as you can. Do the practice exams as they almost mirror the actual ones. Make sure you know how to figure out memory addresses early. Some programs are easy, some  are not.  ",FA 2015,Yes,CS 261 - Data Structures,2,6-12 hours,"This was easier than I thought (got an A). You might want to save this to pair with the tough classes (e.g. I heard 325, 344)",No,,,,
12/21/2015 11:20:11,CS 340 - Introduction to Databases,1,0-5 hours,"If you aren't porting over your CS 290 final project as the final project for this class, don't underestimate the amount of time it will take to pick up your backend language.",FA 2015,Yes,CS 325 - Analysis of Algorithms,5,18+ hours,"Skip all the lectures and office hours held by the prof. Get all of your lectures from the MIT OCW material. Skim the book, then go to YouTube to fill in the gaps. Don't use Python for the TSP project. If you use the Subtract and Conquer/""Muster"" method in place of Iteration for solving recurrences, you won't be marked down on tests.",No,,,,
12/22/2015 11:29:15,CS 161 - Intro to Computer Science I,2,0-5 hours,,FA 2015,Yes,CS 225 - Discrete Structures in Computer Science,1,6-12 hours,,No,,,,
12/30/2015 12:22:58,CS 161 - Intro to Computer Science I,4,6-12 hours,Stay on top of homework. it is critical,FA 2015,No,,,,,,,,,
1/5/2016 11:49:38,CS 340 - Introduction to Databases,2,0-5 hours,The lectures in this course give you everything needed to succeed. Don't wait until the last minute to do the homework or final project. ,FA 2015,Yes,CS 290 - Web Development,4,13-18 hours,"The lectures were way more useful than the book.  Don't get lulled into a false sense of security the first few weeks. It starts off slow,  but the last few weeks were rough. Make sure to understand each new concept,  because the final homework is fairly comprehensive. ",No,,,,
1/8/2016 16:09:02,CS 290 - Web Development,5,18+ hours,"So much new material.  Conceptually not bad.  Debugging in node can be challenging, and the professors material is relatively thorough.  Watch out for The last assignment: database interactions.  ",Fall 2015,Yes,CS 340 - Introduction to Databases,2,6-12 hours,"Fun, simple, not a freebie pay attention.  ",Yes,CS 261 - Data Structures,4,13-18 hours,"Assignments and worksheets take time, be careful and prepare well.  Debugging can be challenging due to longer programs.  Significant amount of material covered.  "
1/24/2016 20:19:18,CS 225 - Discrete Structures in Computer Science,1,0-5 hours,,SP 2015,No,,,,,,,,,
1/28/2016 20:28:26,CS 161 - Intro to Computer Science I,3,6-12 hours,,Fa 2015,No,,,,,,,,,
2/6/2016 15:17:50,CS 161 - Intro to Computer Science I,1,0-5 hours,,SU 2015,No,,,,,,,,,
2/13/2016 10:47:32,CS 271 - Computer Architecture & Assembly Language,2,6-12 hours,,WI 2016,No,,,,,,,,,
2/15/2016 17:23:33,CS 161 - Intro to Computer Science I,4,18+ hours,"Try to get ahead on readings before the course begins. Try to code as many of the review questions for each chapter as you can. Pay attention to the lecture notes, in addition to the textbook.",WI 2016,No,,,,,,,,,
2/23/2016 14:35:05,CS 271 - Computer Architecture & Assembly Language,4,18+ hours,,WI 2016,No,,,,,,,,,
2/27/2016 16:04:44,CS 162 - Intro to Computer Science II,4,18+ hours,Stack Overflow is very helpful,FA 2015,Yes,CS 225 - Discrete Structures in Computer Science,2,6-12 hours,,No,,,,
3/3/2016 3:01:17,CS 161 - Intro to Computer Science I,3,6-12 hours,,WI,No,,,,,,,,,
3/5/2016 17:55:38,CS 225 - Discrete Structures in Computer Science,3,6-12 hours,"Practice different problems in the book, not just the ones for the homework",WI 2016,No,,,,,,,,,
3/13/2016 16:16:29,CS 362 - Software Engineering II,3,6-12 hours,The prof sucks.  Prepare to google a lot.  ,WU 2016,Yes,CS 271 - Computer Architecture & Assembly Language,4,13-18 hours,Do really well on the programs and you don't need to stress about the exams much.  ,No,,,,
3/15/2016 9:43:11,CS 271 - Computer Architecture & Assembly Language,3,6-12 hours,Don't skip the self-check exercises. The quizzes and parts of the final were directly from them.,WI 2016,Yes,CS 361 - Software Engineering I,1,0-5 hours,,No,,,,
