3/8/2021 14:22:59,CS 162 - Intro to Computer Science II,2,6-12 hours,"This class is a pretty natural continuation of 161 and is maybe 3x the time. Assignments 2 and 3 are longer and OOP-heavy, but the readme gives very detailed descriptions of what needs to be done which makes them quite manageable. The rest of the assignments are shorter, but there is a spike in difficulty in weeks 6-8, with a focus on recursion. The portfolio project is a complex board game (my term was Janggi). You have 2-3 weeks to get it done, which is plenty of time. Overall, this class wasn't all that difficult and the instructor, Hedaoo, is awesome. He would be online for 2-4 hours on nights assignments were due to answer questions and help with bugs. ",WI 2021,Yes,CS 271 - Computer Architecture & Assembly Language,3,13-18 hours,"This was the 2nd term of Redfield's overhaul of the course. It is extremely well put together and everything you need to succeed is in the modules (no textbook or outside sources necessary), which is good because there is a MASM void on the internet. The only downfall of the course is the reliance on text, which could be a struggle for people who prefer video (Redfield does scatter videos throughout, but it is 90%+ text). The projects, especially 5 and 6, are challenging but doable. I suggest completing all EC on projects 1-4 to build a buffer, then completing 5 and 6 to requirements. As a pointer,  READ THE REQUIREMENTS OF THE PROJECTS THOROUGHLY BEFORE STARTING. You may build a functioning program but miss the requirements and be surprised by a bad grade. It is very possible to head in to the midterm with 102% in the course, and the final at 101%. Overall, this course was fantastic. Redfield, Vogel, and the ULA's are excellent.",No,,,,
3/12/2021 8:05:36,CS 161 - Intro to Computer Science I,1,6-12 hours,Get ahead if you can. ,WI 2021,No,,,,,,,,,
3/14/2021 13:33:01,CS 261 - Data Structures,2,6-12 hours,"This is a fairly well structured class with each week covering a different data structure. The course is pretty self-contained (you don't really need to look to outside resources to do well).   I would absolutely recommend getting a whiteboard if you don't have one to go through examples/algorithms before you start coding. Assignments are pretty straightforward and your grade on assignments is whatever you get on Gradescope (unlimited submissions, which has pros and cons). If you start assignments early, you should do well. I do think this was a significant step up from 162 so make sure you're comfortable with basic Python concepts before starting this course.",WI 2021,Yes,CS 290 - Web Development,1,6-12 hours,"This course is deceptive because in terms of grading, it's probably easy to get an A without much effort. The problem is if you want to actually learn the material you're going to have to invest time on your own (especially if you're like me and haven't had previous exposure to HTML/CSS/JS). The assignments are again misleading because they are literally knowledge checks that don't have any depth until you get to the last assignment which requires you to put everything together. It is easy to go through the course and then realize you haven't learned enough to complete the last assignment. I'd recommend spending the time week to week to make sure you're understanding the concepts as they come so that you're not scrambling last minute to try to relearn everything for the last assignment.",No,,,,
3/15/2021 4:57:04,CS 162 - Intro to Computer Science II,2,0-5 hours,This class wont demand a lot of your time until the end. Be prepared for the final project. Don't procrastinate.,WI 2021,Yes,CS 225 - Discrete Structures in Computer Science,3,13-18 hours,"Overall, I learned a lot and this course is pretty well designed. Put in the work and you'll be rewarded.

I learned a lot more from the readings than from the lectures. Your mileage may vary.

I created flashcards (using Anki) every week to memorize the key facts. I don't think this was strictly necessary, but I found a lot of value in it. It helped me do the work more confidently and quickly since I didn't need to go double check every definition and property.

The Discussions seem like they're still a work in progress. I found them to be a larger time commitment than they originally appeared and the organization is kind of a mess. I also found there to be a wide variance in difficulty of the discussion problems. If you pick your questions early, you can get the easy ones (if you want), and leave the hard ones to your group mates.",No,,,,
3/17/2021 14:17:50,CS 325 - Analysis of Algorithms,3,6-12 hours,"Abdul Bari's videos on YouTube will save you in this class. Check out the lecture slides to see what topics to review each week, but DO NOT listen to the lectures - they are garbage and will just confuse you. If you do well on the homework and quizzes you can afford to not do great on the exams and still pass the class.",WI 2021,Yes,CS 361 - Software Engineering I,1,0-5 hours,"This course is currently being redesigned, so your experience with it might differ from mine. I found it to be an easy class - just make sure that you look at the rubrics for the assignments to make sure you are getting all the points for your assignments.",No,,,,
3/19/2021 21:16:52,CS 261 - Data Structures,3,6-12 hours,"It's well structured and linear. Felt like a spiritual successor to 162. There was a bit of a crunch during the last few weeks when one of the homeworks covers two modules, but stay ahead during that time and you'll be fine. Workload wasn't relatively that demanding. ",WI 2021,Yes,CS 271 - Computer Architecture & Assembly Language,4,13-18 hours,"It's only difficult because assembly instructions are so bare-bones. For that reason, it takes awhile to program some of the assignments. Just stay ahead during the quarter so that you have extra time for the assignments that are more difficult (I say difficult but it's just because assembly is relatively cumbersome). The midterm and final felt less demanding than I was expecting. Also since you can use typed notes on the exams, just stuff a lot of info on them and you should be well set.",Yes,CS 290 - Web Development,3,6-12 hours,"Some of the content is outdated since web development progresses so quickly. It's a bit annoying that the later materials don't fully show how everything you learned in the quarter is integrated, so you'll have to figure that out yourself. I didn't have any prep for any classes this quarter and that was fine, since the actual content isn't that difficult. Just make sure you try to get full points on the assignments where you can, because the final is a bit of a ball-breaker compared to the rest of the course. It covers content you maybe saw earlier in the quarter but never used yourself, which I thought was pretty dumb. Probably my least favorite course this quarter, even though it wasn't the most difficult, but I expect it will be much better once the course is refreshed/content is updated. That said, I still did enjoy it, just wish the content was current."
3/21/2021 10:48:03,CS 362 - Software Engineering II,2,6-12 hours,"This class covers various testing methods and processes used in Software Engineering. It's straightforward and the materials and workload are not overwhelming. It's great to pair with more intense classes such as 325 or 344 (which I paired it with). The keys to success in this class are: 1) complete all assignments by following the instructions to a tee. They aren't necessarily difficult, but if you don't complete them as specified, you will lose points 2) find your group members for the group project (that happens in the final third of the class) as soon as possible in the term to make sure you find group members in your time zone that are also as ambitious about communicating and completing the project correctly as you are. The final exam is proctored and very fair if you paid any attention at all during the term. ",WI 2021,Yes,CS 344 - Operating Systems,4,18+ hours,"This class is definitely the toughest one I have taken in the program. It's very well organized, unlike the sh*tshow 325 is. It's very information-dense, and if you aren't familiar with the C language, get as much exposure to it as possible before the class starts. The first five assignments are in C, and the sixth assignment is in Rust. Start the programming assignments as soon as they are released, as you will need all the time you can get to complete them. The instructors and TAs were great, and even though the assignments were tough, the expectations were clear and the grading was fair. The final is unproctored and open books, open internet, open terminal, open whatever else you can think of, the only limitation is that you are not allowed to collaborate on it with any other students in the class.",No,,,,
3/21/2021 19:21:57,CS 261 - Data Structures,3,6-12 hours,"I think this quarter (winter 2021) was a bit of a step up from previous quarters in terms of the workload/difficulty of this class. Everything is very well laid out and topics are presented extremely well. You'll consistently write >100 lines of code for the homework, split between a bunch of methods that range from easy return one-liners, to recursive solutions requiring helper methods. Due to the importance of this course, I am happy that I struggled and am now very comfortable with every topic that was taught. Some weeks of this class were just reading and took 1 hour, near the end they stacked assignments and quizzes and I was putting in closer to 15. Overall a reasonably difficult class that you can get an A in with enough effort. We had unproctored, closed book exams that were middle of the road, but that may or may not change post-covid.",WI 2021,No,,,,,,,,,
3/26/2021 9:56:42,CS 271 - Computer Architecture & Assembly Language,4,13-18 hours,Take really good notes and plan out the projects before starting to code them.,WI 2021,Yes,CS 261 - Data Structures,4,6-12 hours,"Not too hard to do well, but at the end a few specific problems ramped up its difficulty quite a lot!",No,,,,
3/27/2021 14:01:53,CS 325 - Analysis of Algorithms,3,6-12 hours,I only watched the provided videos for the last week's material (P vs NP). Otherwise I used Abdul Bari and a few other resources (Back to Back SWE). I never cracked the book. Bari is invaluable for the first few weeks of this class. I think this was the last iteration of this class before it gets revamped- these reviews may be out of date next semester.,WI 2021,No,,,,,,,,,
4/14/2021 11:38:32,CS 340 - Introduction to Databases,2,6-12 hours,"Make sure you have a great partner. A lot of the work is this class is very doable if you divide and conquer. I personally think the class was just a continuation of CS290 except you're allowed to dictate what tech stack works best for your project. Learning about database design was interesting, but besides that, not a lot of data intensive learning. I found getting an A to be pretty straight forward as long as you're careful about the group project requirements. ",WI 2021,No,,,,,,,,,
5/3/2021 21:35:31,CS 372 - Intro to Computer Networks,4,6-12 hours,"If the course stays as it is this term with the newly added projects, it is now much more difficult than previous reviews state. Project 2 was the first time I have ever been legitimately lost on where to start an assignment in my entire academic career. The course has moved from Slack and Piazza to Teams and ed. Teams is dead compared to the good old slack channels from previous terms, and ed looks like someone's pet project.. there is a delay between when you type and when it appears. I came into this course super excited about the topic and am closing it out wanting nothing to do with it.",SP 2021,Yes,CS 340 - Introduction to Databases,3,6-12 hours,"You won't get much help from the instruction team here. Modules are semi-helpful, Weekly quizzes with unlimited attempts and 2 gradescope projects with SQL. This course pretty much comes down to your partner as the whole thing revolves around the term project. I took the class with a friend I made in 261 so it was fine for me, highly suggest going that route if you can. It is a neat class with useful skills but it really is self-teaching heavy.",No,,,,
5/25/2021 6:15:52,CS 464 - Open Source Software,1,0-5 hours,"Super easy and informative class and you get what you put into it. Highly recommend if you're looking for a light and easy elective, but if you want a substantive elective class, you may want to look elsewhere. I spent no more than 1-2 hours a week on this course. You can definitely put in more if you want to add an open source project contribution to your resume since the light workload gives you freedom to do so. Otherwise, the instructors provide lots resources to find open source projects you can contribute to for the purpose of the class. You don't need to necessarily contribute to the codebase either - you can do things like update documentation, provide a cognitive walkthrough, help translate, etc. ",SP 2021,No,,,,,,,,,
5/25/2021 10:21:30,CS 162 - Intro to Computer Science II,3,6-12 hours,"Its as everyone else says, the course material ramps up drastically in the second half of the course, I would say around module 6/7, the concepts will require more time to understand, and will be confusing if you haven't been exposed to the concepts before.",SP 2021,Yes,CS 271 - Computer Architecture & Assembly Language,4,13-18 hours,"This class is great, I love the structure of the class, and it is very well taught. From my experience, the ULAs are very helpful as well. If you enjoy self studying the material, this class will be great for you, and aside from some videos from Redfield, the course is very hands off. I feel like I learned a great deal from this class",No,,,,
5/25/2021 15:57:49,CS 475 - Intro to Parallel Programming,1,0-5 hours,"All items are given immediately, finish ASAP and watch the videos ahead!",SP 2021,Yes,CS 361 - Software Engineering I,1,6-12 hours,"Start communicating with your team ASAP, it's hard to coordinate with others, especially 4 other people.",No,,,,
6/3/2021 10:39:27,CS 475 - Intro to Parallel Programming,2,13-18 hours,,SP 2021,Yes,CS 493 - Cloud Application Development,2,18+ hours,Get an early start on projects. Make your code modularffrom tthe beginningsso you have an easier timer reusing functionality ,No,,,,
6/3/2021 10:41:56,CS 161 - Intro to Computer Science I,1,0-5 hours,Work ahead as much as possible.,FA 2019,Yes,CS 225 - Discrete Structures in Computer Science,3,6-12 hours,Get an early start on the hw as soon as you can. Videos are likely late to post so use them instead as clarification and support for what you learn in the hw,No,,,,
6/3/2021 10:44:54,CS 162 - Intro to Computer Science II,4,13-18 hours,Review python syntax before the term so that you're not spending time reminding yourself about that while new concepts roll in,WI 2020,Yes,CS 271 - Computer Architecture & Assembly Language,3,13-18 hours,Work ahead and do all of the extra credit. It'll save you down the road. ,No,,,,
6/3/2021 11:01:52,CS 475 - Intro to Parallel Programming,2,6-12 hours,"I didn't learn much in this course. Don't take it if you're hoping to learn about something like computing with AWS. There is some conceptual material taught, but it's mostly high level and a lot of syntax. The professor provides most of the project code for you, and your job is mostly to fill in some blanks and write a tedious report. This is done to facilitate a large breadth of projects, but I would've preferred to dive deeper in fewer projects. It seems like the goal of the course is to give you as many buzzwords as possible for your resume. The quizzes and tests were thankfully open note, otherwise they would've required rote memorization of the professor's preferences. Overall I only recommend this class if you're very interested in GPU computing.",SP 2021,No,,,,,,,,,
6/3/2021 11:15:17,CS 475 - Intro to Parallel Programming,2,18+ hours,"This class is different than any other. It's often heralded as the best at OSU. I don't disagree with that on it's face, but I would add some caveats. It's great, but not perfect. Dr. Bailey is one of the few instructors who truly cares about the success of his students. You get all the content up front, he does lecture videos bi-weekly and for the most part, expectations are set up front. This class is also heavy on the writing. Maybe this was a change from previous terms given the amount of time people reported spending on this class in the past. There are 7 projects, each one requires to you do the project (everything is in C++, the first project technically can be done in C). You get exposed to multiple parallel frameworks like OpenCL and CUDA (yea, you write code that runs on GPUs). So that is cool. Then you also have to write a PDF for each project, there are questions that must be answered, graphs and tables to be added, the format of which is a bit specific. There were 2 exams, both which weren't bad, unproctored. There is also a weekly quiz of 5-10 questions each, not bad, and is usually based directly on learned concepts. This class is overall, not hard. But by no means is it a class you spend 5-10 hours a week max on, at all. I averaged 20 hours a week and started pushing 25-30 towards the end. I wasn't struggling at all. I'm pretty comfortable with C++, but there is a lot of guess and check with the code, then gathering data, then writing the PDF to the specific standards set forth (which might require some digging around for information to develop a good answer). TL;DR = Solid class, one of the best at OSU holds true, not hard, but demands significant portions of your time. Professor Bailey is truly one of a kind.",SP 2021,Yes,CS 493 - Cloud Application Development,3,18+ hours,"This is a good class. Cloud technology is important today and very relevant. This class is dipping your toe in that water. The gist (no pun intended) of it is that you spend the term writing and using APIs. The class is reliant on Google Cloud, so you will be rapidly familiarized with Google Compute Engine, Google App Engine, Google Datastore, etc. (...it helps if you have an elementary understanding of their cloud services layout, how to navigate, but not required). All projects can be written in JavaScript (Node.js) or Python (Flask), others are authorized, but you must get instructor permission first. I took the Node path because the whole program deeply leans on Python, and my JS was getting rusty. Projects are all very doable, requirements are mostly clear, though there were a few issues where the requirements would seemingly defy a relevant RFC, like stipulating a Content-Type header had to be set to indicate what MIME type the client was requesting (hint: should be the Accept header, this was fixed). Largely, content is text only, with some video, I didn't really use or review any of it. I heard mixed feelings from classmates that did use it. Flask seems like an afterthought. The real time-sink in this class comes from writing API documentation, and my God, is there a ton. My final project was 66 pages long, not including code, tests, and double-checking everything. The smallest one was 31 pages long. Now a lot of it is repetitive copy and paste, just filling in the boxes of the template they give you. But its still tedious, demanding and looooong. It's not hard, its just a lot. There were 2 exams (basically 10 question quizzes) that felt like more of an afterthought, unproctored. TL;DR = Overall, good class though, I would recommend it, just get your typing fingers ready. Be skilled in either JavaScript or Python. If your fundamentals are weak, you will struggle, but probably get by.",Yes,CS 419/467 - Software Projects,1,13-18 hours,"This class is called 'Online Capstone Project' now. Form a project group before the term starts. Use reddit or reach out to previous friends/group mates who are also taking this class that you thought were good partners. This class is made or broken by your group and its dynamics. I've heard horror stories, but fortunately, that wasn't my case. When the term begins, you can pick a canned project which really, for me lacked any inspiration. A lot of students decide to make a video game, there are lots of those. Our team developed a web-based AI-powered vehicle identification application. Came out good, learned a ton, our team was awesome, and we achieved what we set out to do. We all put about 200 hours into the project each, for a combined total of just south of 600 hours. Broken up over each week though some weeks are light, some weeks are heavy. I was probably averaging 15 hours a week. There is a lot of freedom in this class to basically pick your own project, the approval process is email the instructor with your idea, he says yes or no. That's basically it. You have to record videos each week demonstrating your progress, these can be daunting if you dislike making videos (or appearing in them), but they seem to be flexible with the content you put in them. There are no exams. The project is submitted at the end of the course, with a final report which is fairly easy. We used Google Docs to collab on everything, that worked fine. There is a final video and poster as well. It doesn't have to be remarkable, it just has to present the information they are looking for. Other than that, grades are basically 100's unless you are seriously not doing any work or have some remarkable snafu where it appears you are doing nothing. TL;DR = The people you chose for your group will make or break this class. Learn to make videos and get comfortable at least talking in them. Be project-driven, self-starting and willing to put in your share of effort towards the common goal of completing the project and you will be just fine. Communicate with your team, early and often."
6/5/2021 17:59:20,CS 475 - Intro to Parallel Programming,1,6-12 hours,Watch the lectures. I preferred the live lectures for extra/random tidbits but either will provide exactly what you need. ,SP/2021,Yes,CS 361 - Software Engineering I,1,6-12 hours,Have fun and spend time planning a proper project. ,Yes,CS 362 - Software Engineering II,2,6-12 hours,Be thorough in testing and you'll be fine. 
6/8/2021 15:22:12,CS 340 - Introduction to Databases,2,0-5 hours,"Get a group member early to help ensure your partner is equally motivated. Getting a good partner will make this course go so much more smoothly than an absent or inept partner. The term-long web application consists of a MySQL backend and you can use whatever else you like to create the rest of the project. My group used Node, but others used Flask, React, and some others. Outside of the group project, there are SQL exercises and database design concepts. This course isn't exceedingly difficult and I felt it was really enjoyable and I learned a lot.",SP 2021,No,,,,,,,,,
6/8/2021 15:26:43,CS 290 - Web Development,2,0-5 hours,"This course is generally not too difficult. The materials cover Node, Handlebars, Express, JavaScript, and CSS (and perhaps some more stuff). I didn't think the course was as terrible as I had been led to believe, but the last assignment was a real step up in difficulty compared to everything else we had worked on. The final was rough. A lot of the questions seemed to be more about minor details from throughout the term and some short answer/code questions.",WI 2021,No,,,,,,,,,
6/9/2021 12:33:43,CS 325 - Analysis of Algorithms,4,13-18 hours,"The ""revamp"" of this course is still a hot mess. I think any algorithm course should be difficult, because the topic itself is multi-faceted and incredibly important. 325 added difficulty by being kinda crap. The explorations they provide on Canvas are filled with typos and don't do a good job of teaching material. The only easy things about this class were the open note quizzes due each week and the discussion posts due every other week. The discussion posts were pretty annoying because you had to make a video solution for solving a given problem, but from an interview perspective verbally explaining is good to practice. The coding assignments ranged from easy to hard, with the portfolio assignment (essentially 3 problems with some other analysis) being the peak of difficulty. The midterm/final weren't crazy difficult (you get a 1-sided cheat sheet), but there was so much regrading due to poorly-stated questions being interpreted in different ways. I do feel like I learned a lot about algorithms in spite of this course's quality, but hope they make some much needed updates. ",SP 2021,No,,,,,,,,,
6/10/2021 22:17:06,CS 344 - Operating Systems,4,18+ hours,"This course was definitely the most time consuming of any non-elective class. The material is not overly difficult to comprehend, but the projects are big. Start each assignment ASAP.",SP 2021,Yes,CS 362 - Software Engineering II,2,0-5 hours,Find a good group. Don't just get randomly assigned partners if you can avoid it. You might get burned.,No,,,,
