11/12/2019 15:28:42,CS 161 - Intro to Computer Science I,3,6-12 hours,,SU 2018,No,,,,,,,,,
11/12/2019 15:29:11,CS 162 - Intro to Computer Science II,4,13-18 hours,,FA 2018,No,,,,,,,,,
11/12/2019 15:32:13,CS 225 - Discrete Structures in Computer Science,5,18+ hours,I found the book and course material to be difficult to understand but with enough time spent slowly re-reading everything I was able to get it. I subscribed to Chegg.com specifically for this class which helped me a ton. They literally have the answers on Chegg so be careful not to use it as a crutch. I found it really difficult to see what was done between each step when reading the book or going over lecture materials and found Chegg had more in-depth examples as well as additional examples for other forms.,WI 2015,No,,,,,,,,,
11/12/2019 15:34:21,CS 261 - Data Structures,3,6-12 hours,"I found this course really interesting and the topics covered are SUPER useful and important for pretty much every other class, especially Algorithms. The provided lectures and material are pretty poor so make sure you do whatever is necessary to understand what's being talked about. The concepts covered in this class are fundamental to lots of programming so it's easy to find outside resources.",SP 2019,No,,,,,,,,,
11/12/2019 15:38:11,CS 290 - Web Development,3,6-12 hours,"This is hands down the worst class I have ever taken, ever, at any school or program.The provided material is confusing and doesn't explain what you're doing or why. It fails to connect any previous topics to later topics and frankly made me lose all interest in Web Development. I was told by numerous people to take Colt Steeles Web Dev course on Udemy before taking this class and I'd recommend that to anyone else. It's around $12 and supposedly covers all the topics for this class except way better. Full disclosure, I haven't personally taken Colt Steele course but I'm planning on it cause I actually wanna learn Web Dev and not hate it.",SU 2019,No,,,,,,,,,
11/13/2019 13:08:44,CS 165 - Intro to Computer Science (Accelerated),4,6-12 hours,"Study hard, keep good notes, get into good coding habits, and make sure you understand all of the assignment requirements!",FA 2018,Yes,CS 225 - Discrete Structures in Computer Science,4,6-12 hours,"Be honest about your class understanding with your group mates, be engaged in the Piazza discussions, start work early, and keep good notes. ",No,,,,
11/13/2019 13:10:10,CS 261 - Data Structures,4,6-12 hours,,WI 2019,Yes,CS 271 - Computer Architecture & Assembly Language,5,13-18 hours,"This class was the most difficult for me. Ask lot sof questions, work lots of examples, read all of the notes and watch lectures.",No,,,,
11/13/2019 13:13:17,CS 340 - Introduction to Databases,2,13-18 hours,"Find a really great group partner with the same ideals as you, don't spend too much time on fancy-ing up your project (lay the groundwork first), and read the class lectures (they're actually really helpful)!",FA 2019,Yes,CS 361 - Software Engineering I,2,13-18 hours,"The instructor is terrible, so create great relationships with your group mates to get you through the semester. Write more than you think you need to, study the lectures for the exams, and be prepared to decipher a lot of confusing and vague instructions!",No,,,,
11/13/2019 23:21:33,CS 161 - Intro to Computer Science I,4,18+ hours,"Take an intro to CS course in Python on Coursera or Udemy before this class. No textbook is needed,  but I would google what the best beginner Python books are and buy one of those for extra practice/understanding. Stack Overflow has some pretty bad/inefficient code that doesnt always work. Rely on academic literature online or your personal Python beginners book.",FA 2019,Yes,CS 225 - Discrete Structures in Computer Science,3,13-18 hours,The algebra that you take on ALEKS will not be enough for this course. Best way to prepare is to buy the solutions guide to the textbook and do extra practice problems that resemble the assignments. Pay particular attention to the algebraic techniques. There is a good reason that you are taught Boolean Algebra initially... it carries on for the rest of the quarter into math induction and proofs.,No,,,,
12/1/2019 1:16:42,CS 161 - Intro to Computer Science I,2,0-5 hours,Take an intro to python programing course and you will be fine.,FA 2019,No,,,,,,,,,
12/3/2019 7:58:08,CS 161 - Intro to Computer Science I,1,0-5 hours,"Take a Udemy/Coursera class on Python beforehand. Doing so will morph this class into a cakewalk. I watched people with no prior programming experience wade into this class and have a ton of difficulty. I have no prior professional programming experience but took the Python Masterclass on Udemy over the summer before starting this class and the hardest I had to work was probably on the two projects at the end, both of which took me about 4-8 hours total time each. The time was simply due to how large the projects are compared to previous assignments and subsequent debugging and documenting you will have to do.",FA 2019,Yes,CS 225 - Discrete Structures in Computer Science,4,18+ hours,"I am not really sure what advice I can offer here. The hardest part of the class, for me, is weak/strong mathematical induction around week 4. Things get dramatically easier after that. I am coming up on my finals and still really don't understand induction. The best advice I can give is put something on paper for every question even if it is blatantly wrong (within reason). Whether we are talking about quizzes, exams or assignments, I found the grading to be abundantly lax in this class which I think is its saving grace.",No,,,,
12/3/2019 19:16:13,CS 161 - Intro to Computer Science I,2,6-12 hours,"No textbook required, but free online PDF helps a lot when understanding material. Don't get behind on early material as is all reused on assignments... especially classes. ",FA 2019,Yes,CS 225 - Discrete Structures in Computer Science,4,18+ hours,Use outside resources especially on topics before the midterm. Make sure you understand homework and quizzes prior to midterm and final. Keep on top of the material as it is easy to fall behind. ,No,,,,
12/6/2019 15:34:52,CS 344 - Operating Systems,4,13-18 hours,Easily the most challenging course of the program in terms of the complexity of the programming. Hone your basic C skills before the start of the class and allocate large amounts of time to all of the projects. Do not start a project with fewer than five days before the due date.,FA 2019,Yes,CS 372 - Intro to Computer Networks,3,6-12 hours,This is not a class where you can either read the text or listen to the lectures. Some material that's tested on is present or elaborated upon in one set and not the other.,No,,,,
12/9/2019 8:08:45,CS 361 - Software Engineering I,3,6-12 hours,Stay on top of the material. Very text heavy,FA 2019,No,,,,,,,,,
12/9/2019 22:26:46,CS 493 - Cloud Application Development,3,6-12 hours,Start asap on project 4 and final.,FA 2019,Yes,CS 419/467 - Software Projects,2,6-12 hours,Make sure your team is communicating often every week so that deadlines are hit,No,,,,
12/10/2019 5:32:02,CS 161 - Intro to Computer Science I,2,0-5 hours,,FA 2019,Yes,CS 225 - Discrete Structures in Computer Science,3,6-12 hours,,No,,,,
12/10/2019 6:23:49,CS 362 - Software Engineering II,3,6-12 hours,"Don't expect to learn the ins and outs of testing with the garbage game code that's used throughout the quarter. Lecture material is ok but the assignments don't match the material as well as it should. If no major change has yet been made for Winter 2020, make sure you play & learn the card game Dominion - it'll help a lot. ",FA 2019,No,,,,,,,,,
12/10/2019 8:34:07,CS 261 - Data Structures,4,18+ hours,"Get a group as soon as Slack access is set up. The worksheets have some typos here and there so you'll want to make sure you read them carefully, but so long as you put in the effort you'll get the points. Do not start assignments late, especially the Hashmap one at the end, you will be dealing with a lot of seg faults if your pointer knowledge isn't great.",FA 2019,Yes,CS 290 - Web Development,3,13-18 hours,"Doing a web dev course before this course would help immensely since it's not due for a revamp until late 2020. The front-end portion will be easy, but once you reach the backend prepare to spend a lot of time trying to understand why your requests are not working. All in all it's an easy course but don't slack off.",No,,,,
12/10/2019 14:36:41,CS 361 - Software Engineering I,3,6-12 hours,"The tests are quietly worth a lot of points. I would really study these. I did the best on the final test after studying the content using flash cards. It's kind of sad because I could see the vision of trying to replicate a professional development team, but it puts a lot of stress on the situation when certain group members openly don't care that much about their grade and you're stuck with them. I spent a lot of time micromanaging distracted or non-committed group members, so my grade felt pretty outside of my own control, which was the really stressful part of the class. I was more stressed out in this class than other more technically difficult ones for this reason. I would suggest accounting for group members that might flake out and take control of the group early on along with the few members who actually do show up.",FA 2019,No,,,,,,,,,
12/10/2019 19:52:39,CS 372 - Intro to Computer Networks,3,13-18 hours,"This course is being redesigned, so this review may be outdated. Each week there is ~1 hour of lecture and ~50 dense pages of reading. For the most part, they cover the same material except the reading goes more in-depth.

Most of your grade comes from Canvas quizzes, including the proctored midterm and final. This includes weekly homework quizzes, 2 quasi-exams (non-proctored), a midterm and final (proctored), and make up 69% of your grade. There are practice quizzes available after every week, and they are excellent prep for the midterm and final. If you're doing well on those, you should be very confident going into the exams.

The programming projects are by far the most intellectually challenging part of the course. Start them early and do as much extra credit as possible. This could easily bump your final grade by ~3% or more.

The labs are a nice way to demonstrate what's being taught in lecture, and they are easy. Do them early, because they can take longer than you think.",FA 2019,No,,,,,,,,,
12/12/2019 2:20:59,CS 162 - Intro to Computer Science II,4,18+ hours,"The projects are large enough that asking for help becomes difficult. Do your best to stay ahead. However, the course is changing from C++ to Python and python from my understanding doesn't directly deal with pointers. Not as easy as everyone said it would be. Yes, you will spend a lot of time in this course.",FA 2019,No,,,,,,,,,
12/12/2019 10:09:46,CS 340 - Introduction to Databases,2,6-12 hours,"You should take CS 290 first. The course begins assuming you have a basic knowledge of HTML, JavaScript, and Node. Find a partner on Slack rather than Piazza--they're less likely to ghost you later. Better yet, partner up with someone you know from a previous class. Make sure you both know the basics of Git. We used Flask for our site, and I loved it. Neither of us had used Flask before, but it's much more straightforward than Node.js. I recommend Cory Schafer's Flask tutorial on YouTube. Workload was steady (~10 hrs/week) over the course of the term, except more in the week with the Advanced SQL assignment. The lecture videos start out OK but become less useful/coherent later in the course. Hannah Scott was a very responsive instructor.",FA 2019,Yes,CS 325 - Analysis of Algorithms,4,13-18 hours,"This course is front-loaded: I spent between 14-20 hours per week on it during the first 3 weeks, then about 12 hours per week after that. Dynamic Programming was the most time-consuming assignment. The textbook is dense and difficult to understand, unless you were previously a math major. I reviewed the lecture PowerPoint PDFs instead of watching the lectures. Most of my learning happened from Abdul Bari YouTube videos, GeeksForGeeks, and general internet searches. It is challenging material, but it's made even more challenging due to having to teach yourself every week.The instructor Julianne Schutfort was reasonably active on Piazza but sometimes gave confusing/conflicting advice. This isn't a fun class, but it does lay an adequate foundation for learning different approaches to solve problems.",No,,,,
12/12/2019 10:11:25,CS 271 - Computer Architecture & Assembly Language,3,6-12 hours,"This has been one of my very favorite classes in the program so far. The first 2 weeks have very long readings and lectures.  Don't worry, it eases up. Programs 1-4 are quick and easy.  Program 5 is a step up in difficulty.  Program 6 is the most challenging, so start early on this one.  One of the most organized and well though-out courses in the program.  It is optimally designed for you to learn.  The weekly summaries are open book, and you can take them twice.  This is a great way to learn!  You take it the first time and really find out what you don't know, then you review those concepts more for the 2nd attempt, resulting in real progress.  Quizzes are also open book, but you only get one chance.  2 exams are 40% of your grade, and they are no joke, but about 80% of the questions follow the exact format (or are exactly the same) as ones found on your summaries and quizzes, so you know what to prepare for.  Having been in the IT field for 18 years now, I can offer this advice.  Don't rush through this class, the concepts you learn here will be very helpful for you during your career.  Not that many will be writing Assembly code, but understanding how memory is organized, and how the computer really works is a foundational concept that will pay dividends long into the future.  Take your time, learn the material well, and you'll have a great semester.",FA 2019,No,,,,,,,,,
12/12/2019 10:21:04,CS 362 - Software Engineering II,3,0-5 hours,"In the first few weeks, actually read the dominion code documentation, and the cards the first assignments give you, and really look through and understand the way it all works.  Most of the course involves wading through it and messing with the same things over and over in different ways. It's incredibly tedious but less so if you build a firm grasp on what is going on up front.",FA 2019,Yes,CS 271 - Computer Architecture & Assembly Language,4,6-12 hours,"This is one of the most well-organized and clearly laid out courses in the program.  Watch the lectures, do the reading and the provided exercises each week and you'll be in good shape for the many open-book quizzes.  The midterm and final are pretty rigorous & detail oriented, but again if you go over the provided materials you will be set.   The extra credit on the homework is usually not worth it unless you really want the extra practice - they'll have you do hours of work for an extra point or two.  Your time is better spent just making sure you get all the points on the main assignments/hw/quizzes IMO.",No,,,,
12/12/2019 10:29:32,CS 161 - Intro to Computer Science I,2,0-5 hours,"Do your best to stay on top of things and get help from TAs/Slack/Piazza.

There's no book and no proctored exams in this python redesign, so the external annoyances are minimal.  I took it knowing very little python or programming, and found it to be really quite easy.  I found the optional text (which can be downloaded as free PDF or purchased inexpensively as a paperback) to be a wonderful extension and secondary resource.  

Weekly assignments are short (too short, I would say), and quizzes were open-internet and allowed for a retake.  I took the quizzes first and used them to help guide what I looked at as I reviewed the weekly lessons on Canvas.  Instructor clearly wants everyone to have reasonable shot at 100% on quizzes, based on this setup.  Quiz items are randomized from a larger problem set, and the quiz answer options are randomized as well, so you do have to focus on actually learning the ideas.

The instructor introduces git on week one, and assignments are submitted through GitHub.  However, the true power of git becomes apparent during weeks 8, 9, and 10, when the projects become long enough to warrant branching and merging.  Try to remember that git is your friend when you get there.

You can do some early studying via Udemy or other Python resources if you like, but it is not at all required.  People who come in knowing Python are actually at a sort of disadvantage: we are forbidden from using non-covered topics and tools, and some Piazza/Slack convos were complaints about ""Why can't I use function.method()??""  Do your best to stick to the script, because we are meant to learn the actual logical execution.",FA 2019,Yes,CS 225 - Discrete Structures in Computer Science,3,13-18 hours,"I came in with an unusual level of preparation for this course, so I'm not the best judge of difficulty.  The structure (two weekly assignments, weekly 2-hour quiz, bi-weekly discussion post) means that all students will spend a lot of time on this course.  Most of my classmates who took both 161 and 225 spent at least 80% of their school time on 225.

The grading is extremely lenient overall, rewarding effort and attempts with large partial credit allocations.  The professor was extremely present on Slack and Piazza both, and she seemed to be working hard to answer questions posed by students.  Please ask your questions on Piazza and Slack.  (And, goodness gracious, please understand that ""Anonymous"" posts on Piazza are only anonymous from the students -- the instructor and TAs know who posted what.)",No,,,,
12/13/2019 5:21:55,CS 271 - Computer Architecture & Assembly Language,3,6-12 hours,Do solid work on the programming and quizzes where your effort will pay off because the exams are difficult to score well on. You can follow the grading rubric for the programs and do the assigned exercises to prepare for quizzes to get near perfect scores.,Fall 2019,No,,,,,,,,,
12/13/2019 21:08:32,CS 325 - Analysis of Algorithms,3,13-18 hours,"Course needs a reboot. Lectures are the worst I have experienced thus far. Listen to the class lectures at 2x speed. Doing this barely made them tolerable. If you want a superb explanation of the topics, look at Abdul Bari's youtube page. He was a life saver. ",FA 2019,No,,,,,,,,,
12/13/2019 21:29:14,CS 344 - Operating Systems,3,6-12 hours,"This course has been one of my favorites thus far. The assignments are very challenging, but they provide a great sense of accomplishment once you complete them. Don't wait until two days before the due date to start and then bombard Piazza with questions in desperation. The assignments are worth 75%+ of your grade, so get a jump on them. The instructor and TA's were top notch! They were all very responsive and eager to provide help whenever needed. One of my favorite aspects of this course was the lectures. They are SOOO good compared to many of the others I have experienced up to this point. Awesome job Brewster! If you take the time to learn the concepts for each programming assignment, the final will be a breeze.  ",FA 2019,No,,,,,,,,,
12/16/2019 11:22:38,CS 161 - Intro to Computer Science I,3,6-12 hours,Do Repl.it code problems; study the model solutions carefully; try reading all the optional chapters; pay attention to what is covered on Canvas; do not use concepts/tools not covered yet; find a way to organize the material to keep track of what has been covered; revisit each week at least 2-3 times as you progress through the course; start coding week 9 and week 10 projects early; participate in online discussions  ask & answer; explain concepts to your classmates  helps you solidify; use pythontutor; get in the habit of drawing diagrams and variable states; get in the habit of tracing the code; the learning materials are thoroughly thought-through and have solid underlying logic.,FA 2019,Yes,CS 225 - Discrete Structures in Computer Science,5,18+ hours,"Start early with homework. Make sure you do every exercise and read each assigned reading. Try doing extra problems. The class is not hard as long as youre studying every day. Midterm and Final exams guides are there for a reason - do every problem listed there. Make sure to do problems in the lecture slides as well as in weekly quizzes. The TAs are very helpful, but make sure that you read assignments and do the problems first.  ",No,,,,
12/16/2019 20:48:06,CS 325 - Analysis of Algorithms,4,13-18 hours,"This class is definitely front loaded due to all of the math you may have forgotten or need to learn. Once you get over that hurdle, you will then need to absorb all of the material from the lecture, outside videos (Bari), and other resources you can find online. Most lecture videos from the professor are ok except for a few. The book is horrible and dense, didn't really need it. Do well in the HW and quizzes and you will be in good shape come test time.",FA 2019,No,,,,,,,,,
12/18/2019 8:21:53,CS 325 - Analysis of Algorithms,3,6-12 hours,The book is entirely useless for the class and I got a good grade without ever touching it. The lectures are okay but I highly recommend that you look up other lectures on youtube that are related to the weekly topic.,FA 2019,Yes,CS 362 - Software Engineering II,1,6-12 hours,If you have a good group this class isn't terribly difficult. Grading is lenient and the material isn't anything too complex.,No,,,,
12/18/2019 16:37:24,CS 325 - Analysis of Algorithms,3,6-12 hours,Don't bother reading the textbook.  It's honestly a big waste of time.  The lectures are useful but I learned the majority of the material through youtube videos.  Don't stress the fine details.  Focus on the big ideas and concepts and you will do just fine in this class.  ,Fall 2019,No,,,,,,,,,
12/19/2019 10:57:31,CS 373 - Defense Against the Dark Arts,1,6-12 hours,"This course was pretty easy, and the grading was lenient if it looked like you put in a good amount of effort. The lectures will take you a fair bit of time (3+ hrs per week), but the material was very interesting and the labs were fun. Professor McGrath was also very engaged with the course and was always willing to answer questions on Slack.  My only gripe is that the material is starting to become outdated (The lectures were recorded in 2015). One of the labs used a VM with XP, for reference. That said, the lectures are very good, as they are taught by experts from Intel/McAfee, just need some updating. ",FA 2019,No,,,,,,,,,
12/22/2019 11:55:15,CS 493 - Cloud Application Development,3,6-12 hours,"One of the best classes I have taken, with a project that yielded instant results when added to my resume. Percentage of callbacks from applications doubled with all the great buzz words I could show off from this class alone. Now I have to decide which job to take...

You have to read the documentation for the tools you use. Keep your code organized, and object oriented with the intent of reusing much of it for future assignments and the class is not hard...not necessarily easy either.

The instructor is responsive, and the grading is fair. It can be time consuming at times, but I never had to go over things repeatedly like in Algo. There are a lot of concepts but once you got it, you got it, no need for heavy reinforcement...only exception is Oauth. ",FA 2019,Yes,CS 373 - Defense Against the Dark Arts,1,6-12 hours,"They don't care about this class...I gave less and less effort each week and still got an A. Im pretty good at BSing write ups, so maybe I have an advantage there.

Some interesting topics, some insight into hacking, but one of my least favorite courses behind SE1 and SE2. Kind of turned me off from pursuing a career in security.  ",No,,,,
